description,"Carbohydrate, by difference",Energy (kcal),Protein,Total lipid (fat)
"Cheese, cheddar",2.32,388.57,22.19,32.38
"Milk, human",2.8,28.46,0.42,1.78
"Milk, NFS",1.98,21.31,1.36,0.88
"Milk, whole",1.9,25.0,1.34,1.31
"Milk, reduced fat (2%)",2.01,20.49,1.38,0.78
"Milk, low fat (1%)",2.12,17.62,1.39,0.39
"Milk, fat free (skim)",2.02,13.93,1.41,0.03
"Milk, lactose free, low fat (1%)",2.12,17.62,1.39,0.39
"Milk, lactose free, fat free (skim)",2.02,13.93,1.41,0.03
"Milk, lactose free, reduced fat (2%)",2.01,20.49,1.38,0.78
"Milk, lactose free, whole",1.9,25.0,1.34,1.31
"Buttermilk, fat free (skim)",1.96,16.39,1.36,0.44
"Buttermilk, whole",2.0,25.41,1.32,1.36
"Kefir, NS as to fat content",3.07,21.31,1.47,0.39
"Goat's milk, whole",1.82,28.28,1.46,1.7
"Milk, dry, reconstituted, NS as to fat content",1.89,13.11,1.31,0.03
"Milk, dry, reconstituted, whole",2.4,31.15,1.64,1.67
"Milk, dry, reconstituted, low fat (1%)",1.86,16.39,1.3,0.41
"Milk, dry, reconstituted, fat free (skim)",1.89,13.11,1.31,0.03
"Milk, evaporated, NS as to fat content",3.98,53.17,2.7,3.0
"Milk, evaporated, whole",3.98,53.17,2.7,3.0
"Milk, evaporated, reduced fat (2%)",4.42,36.51,2.94,0.78
"Milk, evaporated, fat free (skim)",4.5,30.95,3.0,0.08
"Milk, condensed, sweetened",17.89,105.59,2.6,2.86
"Non-dairy milk, NFS",1.29,11.89,0.47,0.55
Soy milk,2.14,21.72,1.4,0.84
"Soy milk, light",0.53,15.57,1.45,0.87
"Soy milk, nonfat",0.53,15.57,1.45,0.87
"Soy milk, chocolate",3.41,26.23,1.37,0.83
"Soy milk, light, chocolate",0.6,15.98,1.48,0.88
"Almond milk, sweetened",1.77,12.3,0.22,0.48
"Almond milk, sweetened, chocolate",3.05,17.62,0.23,0.49
"Almond milk, unsweetened",0.14,6.15,0.23,0.5
"Almond milk, unsweetened, chocolate",0.21,6.56,0.25,0.52
Rice milk,3.76,19.26,0.11,0.4
Coconut milk,1.2,12.7,0.09,0.85
"Yogurt, NFS",6.23,55.75,4.65,1.37
"Yogurt, Greek, NS as to type of milk or flavor",2.63,48.67,6.63,1.28
"Yogurt, NS as to type of milk or flavor",6.23,55.75,4.65,1.37
"Yogurt, NS as to type of milk, plain",6.23,55.75,4.65,1.37
"Yogurt, whole milk, plain",4.12,53.98,3.07,2.88
"Yogurt, low fat milk, plain",6.23,55.75,4.65,1.37
"Yogurt, nonfat milk, plain",6.8,49.56,5.07,0.16
"Yogurt, Greek, NS as to type of milk, plain",2.63,48.67,6.63,1.28
"Yogurt, Greek, whole milk, plain",2.65,64.67,6.0,3.33
"Yogurt, Greek, low fat milk, plain",2.63,48.67,6.63,1.28
"Yogurt, Greek, nonfat milk, plain",2.43,39.33,6.87,0.25
"Yogurt, NS as to type of milk, fruit",12.8,78.76,4.12,1.21
"Yogurt, whole milk, fruit",10.94,76.99,2.74,2.54
"Yogurt, low fat milk, fruit",22.59,139.06,7.28,2.14
"Yogurt, nonfat milk, fruit",13.29,73.45,4.5,0.15
"Yogurt, Greek, NS as to type of milk, fruit",8.19,70.0,5.45,1.71
"Yogurt, Greek, whole milk, fruit",8.19,70.67,4.89,2.0
"Yogurt, Greek, low fat milk, fruit",21.56,184.21,14.33,4.51
"Yogurt, Greek, nonfat milk, fruit",8.13,54.67,5.37,0.1
"Yogurt, NS as to type of milk, flavors other than fruit",8.69,64.6,4.5,1.34
"Yogurt, whole milk, flavors other than fruit",8.33,69.03,2.92,2.74
"Yogurt, low fat milk, flavors other than fruit",15.34,114.06,7.95,2.36
"Yogurt, nonfat milk, flavors other than fruit",9.24,58.41,4.92,0.16
"Yogurt, Greek, NS as to type of milk, flavors other than fruit",6.36,63.33,5.76,1.67
"Yogurt, Greek, whole milk, flavors other than fruit",6.23,74.0,5.65,2.96
"Yogurt, Greek, low fat milk, flavors other than fruit",16.74,166.67,15.16,4.39
"Yogurt, Greek, nonfat milk, flavors other than fruit",6.91,52.0,5.76,0.12
"Yogurt, Greek, with oats",14.07,106.67,5.92,3.07
"Yogurt, liquid",12.7,77.42,3.99,1.17
"Chipotle dip, yogurt based",22.2,1260.0,52.87,106.6
"Onion dip, yogurt based",27.07,1066.67,45.47,86.07
"Ranch dip, yogurt based",27.53,1300.0,56.53,107.27
"Spinach dip, yogurt based",23.93,1060.0,46.8,86.4
Tzatziki dip,26.13,620.0,35.67,42.07
"Vegetable dip, yogurt based",25.07,1273.33,54.4,106.87
"Yogurt parfait, low fat, with fruit",10.57,56.0,2.24,0.67
"Frozen yogurt, NFS",12.34,72.57,1.71,2.06
"Frozen yogurt, vanilla",12.34,72.57,1.71,2.06
"Frozen yogurt, chocolate",12.34,74.86,1.71,2.06
"Frozen yogurt, soft serve, vanilla",13.83,90.86,2.29,3.2
"Frozen yogurt, soft serve, chocolate",14.21,91.43,2.46,3.29
Frozen yogurt sandwich,45.84,272.0,5.2,8.33
"Frozen yogurt bar, vanilla",33.23,195.38,4.62,5.54
"Frozen yogurt bar, chocolate",33.23,201.54,4.62,5.54
"Frozen yogurt cone, chocolate",19.12,113.6,2.56,2.98
"Frozen yogurt cone, vanilla",19.12,111.2,2.56,2.98
"Frozen yogurt cone, vanilla, waffle cone",9.91,56.08,1.29,1.42
"Frozen yogurt cone, chocolate, waffle cone",9.91,57.65,1.29,1.42
"Baby Toddler food, NFS",60.53,500.0,32.67,14.33
"Baby Toddler yogurt, plain",31.07,406.67,23.13,21.67
"Baby Toddler yogurt, with fruit",73.87,553.33,21.07,19.53
"Chocolate milk, NFS",5.43,27.02,1.37,0.0
"Chocolate milk, ready to drink, whole",4.17,33.47,1.28,1.37
"Chocolate milk, ready to drink, reduced fat",4.89,30.65,1.21,0.77
"Chocolate milk, ready to drink, fat free",5.43,27.02,1.37,0.0
"Chocolate milk, ready to drink, low fat",32.74,206.45,11.16,3.58
"Chocolate milk, ready to drink, reduced sugar, NS as to milk",3.1,22.98,1.38,0.42
"Chocolate milk, ready to drink, low fat (Nesquik)",4.09,25.81,1.4,0.45
"Chocolate milk, ready to drink, low fat, no sugar added (Nesquik)",4.09,25.81,1.4,0.45
"Hot chocolate / Cocoa, ready to drink",6.67,36.69,1.1,0.62
"Hot chocolate / Cocoa, ready to drink, made with nonfat milk",6.67,31.45,1.12,0.02
"Hot chocolate / Cocoa, ready to drink, made with non-dairy milk",6.57,32.26,0.51,0.44
"Hot chocolate / Cocoa, ready to drink, with whipped cream",6.4,41.53,1.1,1.28
"Chocolate milk, made from dry mix with whole milk",3.99,33.06,1.35,1.27
"Chocolate milk, made from dry mix with reduced fat milk",4.09,29.03,1.38,0.77
"Chocolate milk, made from dry mix with fat free milk",4.1,22.98,1.41,0.09
"Chocolate milk, made from dry mix with non-dairy milk",3.99,23.79,0.71,0.56
"Chocolate milk, made from dry mix, NS as to type of milk (Nesquik)",4.07,29.84,1.38,0.87
"Chocolate milk, made from dry mix with whole milk (Nesquik)",3.99,33.06,1.35,1.27
"Chocolate milk, made from dry mix with reduced fat milk (Nesquik)",4.09,29.03,1.38,0.77
"Chocolate milk, made from dry mix with low fat milk (Nesquik)",4.2,26.21,1.39,0.42
"Chocolate milk, made from dry mix with fat free milk (Nesquik)",4.1,22.98,1.41,0.09
"Chocolate milk, made from dry mix with non-dairy milk (Nesquik)",3.99,23.79,0.71,0.56
"Chocolate milk, made from no sugar added dry mix with reduced fat milk (Nesquik)",3.08,25.4,1.46,0.81
"Chocolate milk, made from no sugar added dry mix with non-dairy milk (Nesquik)",2.97,20.16,0.76,0.59
"Chocolate milk, made from syrup, NS as to type of milk",5.3,32.66,1.17,0.75
"Chocolate milk, made from syrup with whole milk",5.23,35.89,1.14,1.12
"Chocolate milk, made from syrup with reduced fat milk",5.32,31.85,1.17,0.67
"Chocolate milk, made from syrup with low fat milk",5.42,29.44,1.18,0.33
"Chocolate milk, made from syrup with fat free milk",5.33,26.21,1.2,0.03
"Chocolate milk, made from syrup with non-dairy milk",5.22,27.42,0.55,0.46
"Chocolate milk, made from light syrup with whole milk",3.38,29.44,1.23,1.18
"Chocolate milk, made from light syrup with reduced fat milk",3.48,25.4,1.25,0.72
"Chocolate milk, made from light syrup with low fat milk",3.58,22.98,1.26,0.38
"Chocolate milk, made from light syrup with fat free milk",3.48,19.76,1.28,0.08
"Chocolate milk, made from sugar free syrup with whole milk",2.35,23.79,1.3,1.23
"Hot chocolate / Cocoa, made with dry mix and water",4.6,21.77,0.37,0.22
"Hot chocolate / Cocoa, made with dry mix and whole milk",6.1,42.74,1.5,1.33
"Hot chocolate / Cocoa, made with dry mix and reduced fat milk",6.19,38.71,1.53,0.88
"Hot chocolate / Cocoa, made with dry mix and low fat milk",6.29,36.29,1.54,0.55
"Hot chocolate / Cocoa, made with dry mix and fat free milk",6.2,33.06,1.56,0.24
"Hot chocolate / Cocoa, made with dry mix and non-dairy milk",6.07,33.87,0.9,0.68
"Hot chocolate / Cocoa, made with no sugar added dry mix and water",3.06,15.98,0.66,0.13
"Hot chocolate / Cocoa, made with no sugar added dry mix and whole milk",5.05,43.22,2.14,1.6
"Hot chocolate / Cocoa, made with no sugar added dry mix and reduced fat milk",5.17,38.19,2.18,1.0
"Hot chocolate / Cocoa, made with no sugar added dry mix and low fat milk",5.3,35.18,2.19,0.56
"Hot chocolate / Cocoa, made with no sugar added dry mix and fat free milk",5.18,31.16,2.21,0.16
"Hot chocolate / Cocoa, made with no sugar added dry mix and non-dairy milk",5.03,32.16,1.35,0.73
"Strawberry milk, NFS",17.23,167.74,10.77,6.13
"Strawberry milk, whole",4.75,34.68,1.22,1.2
"Strawberry milk, reduced fat",4.31,28.63,1.27,0.73
"Strawberry milk, low fat",4.96,27.82,1.26,0.36
"Strawberry milk, fat free",38.9,196.77,10.26,0.29
"Strawberry milk, reduced sugar",2.85,20.16,1.33,0.38
"Strawberry milk, non-dairy",4.75,25.4,0.58,0.5
"Milk, malted",3.38,25.78,1.25,0.8
Eggnog,3.14,34.38,1.78,1.64
"Milk shake, home recipe, chocolate",48.32,428.57,12.39,21.93
"Milk shake, home recipe, flavors other than chocolate",40.68,403.57,11.96,21.36
"Milk shake, home recipe, chocolate, light",46.18,346.43,14.25,11.82
"Milk shake, home recipe, flavors other than chocolate, light",49.39,328.57,13.86,8.32
Milk shake with malt,48.71,446.43,13.43,21.82
"Milk shake, fast food, chocolate",5.03,37.04,0.91,1.64
"Milk shake, fast food, flavors other than chocolate",4.84,36.54,0.83,1.61
"Milk shake, bottled, chocolate",65.68,483.87,11.94,21.48
"Milk shake, bottled, flavors other than chocolate",63.19,477.42,10.87,21.03
Licuado or Batido,48.52,277.78,8.63,5.37
"Fruit smoothie, NFS",43.19,240.74,8.7,4.07
"Fruit smoothie, with whole fruit and dairy",43.22,240.74,8.7,4.07
"Fruit smoothie, with whole fruit and dairy, added protein",35.93,288.89,27.33,4.63
"Fruit smoothie juice drink, with dairy",55.74,240.74,3.19,0.52
Chocolate milk drink,4.31,19.76,0.26,0.16
"Infant formula, NFS",23.34,216.39,4.52,11.67
"Infant formula, Similac, NFS",22.62,213.11,4.49,11.8
"Infant formula, Similac Alimentum, ready-to-feed",22.2,219.67,5.9,11.9
"Infant formula, Similac Alimentum, powder, made with water",22.2,219.67,5.9,11.9
"Infant formula, Similac Advance, ready-to-feed",22.52,216.39,4.49,11.87
"Infant formula, Similac Advance, powder, made with tap water",22.52,216.39,4.49,11.87
"Infant formula, Similac Advance, powder, made with bottled water",22.52,216.39,4.49,11.87
"Infant formula, Similac Advance, powder, made with baby water",22.52,216.39,4.49,11.87
"Infant formula, Similac Sensitive, ready-to-feed",22.92,213.11,4.59,11.57
"Infant formula, Similac Sensitive, powder, made with tap water",22.92,213.11,4.59,11.57
"Infant formula, Similac Sensitive, powder, made with bottled water",22.92,213.11,4.59,11.57
"Infant formula, Similac Sensitive, powder, made with baby water",22.92,213.11,4.59,11.57
"Infant formula, Similac for Spit-Up, ready-to-feed",22.62,213.11,4.52,11.41
"Infant formula, Similac for Spit-Up, powder, made with water",22.62,213.11,4.52,11.41
"Toddler formula, Similac Go and Grow",19.25,190.16,5.67,10.2
"Infant formula, Enfamil, NFS",24.07,216.39,4.69,11.44
"Infant formula, Enfamil Premium Newborn, ready-to-feed",24.23,216.39,4.52,11.41
"Infant formula, Enfamil Premium Newborn, powder, made with water",24.23,216.39,4.52,11.41
"Infant formula, Enfamil Infant, ready-to-feed",24.2,216.39,4.59,11.44
"Infant formula, Enfamil Infant, powder, made with tap water",24.2,216.39,4.59,11.44
"Infant formula, Enfamil Infant, powder, made with bottled water",24.2,216.39,4.59,11.44
"Infant formula, Enfamil Infant, powder, made with baby water",24.2,216.39,4.59,11.44
"Infant formula, Enfamil AR, ready-to-feed",24.36,213.11,5.25,10.62
"Infant formula, Enfamil AR, powder, made with water",24.36,213.11,5.25,10.62
"Infant formula, Enfamil Gentlease, ready-to-feed",23.77,219.67,5.02,11.44
"Infant formula, Enfamil Gentlease, powder, made with tap water",23.77,219.67,5.02,11.44
"Infant formula, Enfamil Gentlease, powder, made with bottled water",23.77,219.67,5.02,11.44
"Infant formula, Enfamil Gentlease, powder, made with baby water",23.77,219.67,5.02,11.44
"Toddler formula, Enfamil Enfagrow",23.8,216.39,5.61,11.54
"Toddler formula, PediaSure",35.97,319.35,9.23,15.39
"Toddler formula, Nido Kinder",21.54,203.28,5.64,10.89
"Toddler formula, store brand, beginning or next stage",21.54,203.28,5.64,10.89
"Toddler formula, store brand, pediatric shake",35.97,319.35,9.23,15.39
"Infant formula, Gerber, NFS",23.8,213.11,4.89,10.92
"Infant formula, Gerber Good Start Gentle, Stage 1, ready-to-feed",23.93,216.39,4.75,10.95
"Infant formula, Gerber Good Start Gentle, Stage 1, powder, made with tap water",23.93,216.39,4.75,10.95
"Infant formula, Gerber Good Start Gentle, Stage 1, powder, made with bottled water",23.93,216.39,4.75,10.95
"Infant formula, Gerber Good Start Gentle, Stage 1, powder, made with baby water",23.93,216.39,4.75,10.95
"Infant formula, Gerber Good Start Gentle, Stage 2",23.93,216.39,4.75,10.95
"Toddler formula, Gerber Good Start, Stage 3",21.54,203.28,5.64,10.89
"Infant formula, premature, powder, made with water",23.51,229.51,6.43,12.39
"Infant formula, premature, ready-to-feed",23.51,229.51,6.43,12.39
"Infant formula, organic, powder, made with water",23.34,216.39,4.52,11.67
"Infant formula, organic, ready-to-feed",23.34,216.39,4.52,11.67
"Infant formula, store brand, advantage or tender, powder, made with tap water",23.34,216.39,4.52,11.67
"Infant formula, store brand, advantage or tender, powder, made with bottled water",23.34,216.39,4.52,11.67
"Infant formula, store brand, advantage or tender, powder, made with baby water",23.34,216.39,4.52,11.67
"Infant formula, store brand, gentle or sensitivity",23.34,216.39,4.79,11.51
"Infant formula, store brand, added rice",23.51,213.11,4.89,11.02
"Infant formula, Enfamil ProSobee, ready-to-feed",22.49,216.39,5.31,11.44
"Infant formula, Enfamil ProSobee, powder, made with tap water",22.49,216.39,5.31,11.44
"Infant formula, Enfamil ProSobee, powder, made with bottled water",22.49,216.39,5.31,11.44
"Infant formula, Enfamil ProSobee, powder, made with baby water",22.49,216.39,5.31,11.44
"Infant formula, Similac Isomil Soy, ready-to-feed",22.07,213.11,5.18,11.57
"Infant formula, Similac Isomil Soy, powder, made with tap water",22.07,213.11,5.18,11.57
"Infant formula, Similac Isomil Soy, powder, made with bottled water",22.07,213.11,5.18,11.57
"Infant formula, Similac Isomil Soy, powder, made with baby water",22.07,213.11,5.18,11.57
"Infant formula, Similac for Diarrhea",21.87,216.39,5.77,11.8
"Infant formula, Gerber Good Start Soy, Stage 1, ready-to-feed",23.34,209.84,5.25,10.75
"Infant formula, Gerber Good Start Soy, Stage 1, powder, made with tap water",23.34,209.84,5.25,10.75
"Infant formula, Gerber Good Start Soy, Stage 1, powder, made with bottled water",23.34,209.84,5.25,10.75
"Infant formula, Gerber Good Start Soy, Stage 1, powder, made with baby water",23.34,209.84,5.25,10.75
"Infant formula, store brand, soy",22.26,213.11,5.25,11.51
"Infant formula, Enfamil Nutramigen, ready-to-feed",21.64,209.84,5.9,11.02
"Infant formula, Enfamil Nutramigen, powder, made with water",21.64,209.84,5.9,11.02
"Infant formula, Enfamil Pregestimil, ready-to-feed",22.39,219.67,5.93,11.87
"Infant formula, Enfamil Pregestimil, powder, made with water",22.39,219.67,5.93,11.87
"Infant formula, amino acids",21.64,213.11,5.93,11.02
"Infant formula, low iron",22.62,216.39,4.69,11.8
"Milk, dry, not reconstituted, NS as to fat content",40.61,282.81,28.25,0.6
"Milk, dry, not reconstituted, fat free (skim)",76.44,532.35,53.18,1.13
"Whey, sweet, dry",930.75,4412.5,161.62,13.38
"Cocoa powder, not reconstituted",1158.0,4560.0,392.0,274.0
"Chocolate beverage powder, dry mix, not reconstituted",902.8,4000.0,45.5,22.7
"Chocolate beverage powder, light, dry mix, not reconstituted",683.1,3500.0,90.9,45.0
"Milk, malted, dry mix, not reconstituted",1690.18,6763.64,0.0,0.0
"Strawberry beverage powder, dry mix, not reconstituted",991.0,3890.0,1.0,2.0
"Cream, NS as to light, heavy, or half and half",1.79,54.58,1.3,4.79
"Cream, light",1.52,81.25,1.23,7.96
"Cream, half and half",1.79,54.58,1.3,4.79
"Cream, half and half, flavored",1.88,54.17,1.28,4.7
"Cream, half and half, fat free",3.75,24.58,1.08,0.58
"Cream, heavy",1.18,141.67,1.18,15.03
"Cream, whipped",21.48,857.5,6.68,84.85
"Coffee creamer, NFS",4.74,56.67,0.42,4.15
"Coffee creamer, liquid",4.74,56.67,0.42,4.15
"Coffee creamer, liquid, flavored",14.61,104.58,0.29,5.62
"Coffee creamer, liquid, fat free",3.79,29.58,0.33,1.46
"Coffee creamer, liquid, fat free, flavored",13.22,64.17,0.25,1.12
"Coffee creamer, liquid, fat free, sugar free, flavored",3.79,29.58,0.33,1.46
"Coffee creamer, liquid, sugar free, flavored",3.79,29.58,0.33,1.46
"Coffee creamer, powder",63.07,562.77,2.64,35.02
"Coffee creamer, powder, flavored",80.23,512.77,0.72,22.84
"Coffee creamer, powder, fat free",78.09,458.51,2.02,16.7
"Coffee creamer,powder, fat free, flavored",78.09,458.51,2.02,16.7
"Coffee creamer,powder, sugar free, flavored",63.07,562.77,2.64,35.02
"Coffee creamer, soy, liquid",4.74,56.67,0.42,4.15
Whipped topping,30.73,424.0,1.67,33.75
"Whipped topping, fat free",31.47,298.67,4.0,17.47
"Whipped topping, sugar free",31.47,298.67,4.0,17.47
"Sour cream, regular",30.87,1320.0,16.27,129.0
"Sour cream, light",47.33,906.67,23.33,70.67
"Sour cream, fat free",104.0,493.33,20.67,0.0
"Sour cream, imitation",44.2,1386.67,16.0,130.13
"Dip, NFS",23.27,2886.67,14.93,305.6
"Chipotle dip, regular",18.0,2846.67,11.27,304.93
"Chipotle dip, light",88.0,1300.0,12.13,101.0
"Onion dip, regular",23.73,2313.33,12.67,241.93
"Onion dip, light",79.13,1106.67,13.33,82.4
"Ranch dip, regular",23.27,2886.67,14.93,305.6
"Ranch dip, light",93.0,1340.0,15.67,101.67
"Spinach dip, regular",20.6,2306.67,14.07,242.33
"Spinach dip, light",76.13,1100.0,14.67,82.73
"Vegetable dip, regular",20.8,2866.67,12.8,305.2
"Vegetable dip, light",90.67,1320.0,13.6,101.27
"Ice cream, NFS",19.53,163.7,2.64,8.37
"Ice cream, vanilla",17.48,153.33,2.59,8.15
"Ice cream, vanilla, with additional ingredients",21.79,172.86,2.62,8.4
"Ice cream, chocolate",20.89,160.0,2.81,8.15
"Ice cream, chocolate, with additional ingredients",24.56,177.86,2.81,8.4
"Ice cream, soft serve, vanilla",16.83,102.86,2.73,2.76
"Ice cream, soft serve, chocolate",14.69,106.86,2.86,4.11
"Gelato, vanilla",12.74,142.29,2.0,9.26
"Gelato, chocolate",11.3,143.43,2.7,9.7
"Ice cream bar, vanilla",49.49,477.33,2.81,33.68
"Ice cream bar, vanilla, chocolate coated",32.67,441.33,5.47,32.13
Ice cream candy bar,61.8,646.0,8.8,40.4
"Ice cream bar, chocolate",33.56,438.67,5.88,31.85
"Ice cream sandwich, vanilla",47.84,352.0,5.71,15.73
"Ice cream sandwich, chocolate",52.44,360.0,6.0,15.73
Ice cream cookie sandwich,57.8,422.67,6.15,18.81
"Ice cream cone, scooped, vanilla",20.66,172.0,2.94,8.67
"Ice cream cone, scooped, vanilla, waffle cone",10.65,85.49,1.47,4.15
"Ice cream cone, NFS",22.78,183.2,3.0,8.9
"Ice cream cone, scooped, chocolate",24.18,179.2,3.18,8.67
"Ice cream cone, scooped, chocolate, waffle cone",12.35,89.02,1.58,4.15
"Ice cream cone, soft serve, vanilla",25.15,151.2,3.93,3.93
"Ice cream cone, soft serve, chocolate",22.26,156.8,4.1,5.74
"Ice cream cone, soft serve, vanilla, waffle cone",12.81,75.69,1.95,1.87
"Ice cream cone, soft serve, chocolate, waffle cone",11.43,78.43,2.03,2.74
"Ice cream cone, vanilla, prepackaged",36.19,372.63,5.48,23.03
"Ice cream cone, chocolate, prepackaged",36.44,371.58,5.63,22.95
"Ice cream soda, flavors other than chocolate",5.84,35.42,0.38,1.21
"Ice cream soda, chocolate",6.35,36.25,0.42,1.21
"Ice cream sundae, NFS",17.73,135.0,2.07,6.21
"Ice cream sundae, fruit topping",18.15,122.78,1.52,5.12
Banana split,6.65,40.61,0.5,1.41
"Ice cream sundae, hot fudge topping",17.73,135.0,2.07,6.21
"Ice cream sundae, caramel topping",17.01,118.33,1.65,5.11
"Ice cream, fried",24.27,208.89,2.92,11.23
"Light ice cream, NFS",18.84,128.89,3.24,4.55
"Light ice cream, vanilla",18.84,128.89,3.24,4.55
"Light ice cream, chocolate",19.44,133.33,3.16,4.79
"Soft serve, blended with candy or cookies, from fast food",12.18,81.86,1.86,2.82
"Light ice cream sandwich, vanilla",49.68,318.67,6.57,10.87
"Light ice cream sandwich, chocolate",50.48,324.0,6.47,11.2
"Light ice cream bar, vanilla",25.01,314.67,4.31,22.2
"Light ice cream bar, vanilla, chocolate coated",25.53,314.67,4.52,22.16
"Light ice cream bar, chocolate",26.32,320.0,4.41,22.48
Creamsicle,50.38,253.85,2.37,4.74
Fudgesicle,46.14,250.77,3.94,5.65
"Light ice cream cone, vanilla, prepackaged",36.03,234.74,5.69,7.68
"Light ice cream cone, chocolate, prepackaged",36.71,238.95,5.6,7.96
"Sherbet, all flavors",17.37,82.29,0.63,1.14
"Fudgesicle, light",51.36,275.56,8.16,4.16
"Pudding, chocolate, NFS",8.85,54.62,0.8,1.77
"Pudding, bread",11.76,78.0,2.8,2.43
"Pudding, flavors other than chocolate, NFS",8.69,50.0,0.56,1.45
Custard,4.22,37.31,1.95,1.4
Flan,10.86,68.46,2.01,1.9
Creme brulee,6.87,43.46,1.56,1.09
"Pudding, rice",7.07,41.54,1.24,0.83
"Firni, Indian pudding",9.67,55.38,1.38,1.19
"Pudding, tapioca, made from dry mix",8.34,50.0,0.75,1.49
"Pudding, flavors other than chocolate, made from dry mix",7.45,40.77,1.07,0.73
"Pudding, chocolate, made from dry mix",7.82,43.46,1.21,0.81
"Pudding, flavors other than chocolate, made from dry mix, sugar free",3.67,26.92,1.22,0.8
"Pudding, chocolate, made from dry mix, sugar free",4.03,29.23,1.34,0.83
"Pudding, flavors other than chocolate, ready-to-eat",8.69,50.0,0.56,1.45
"Pudding, flavors other than chocolate, ready-to-eat, sugar free",3.67,26.92,1.22,0.8
"Pudding, chocolate, ready-to-eat",8.85,54.62,0.8,1.77
"Pudding, chocolate, ready-to-eat, sugar free",4.03,29.23,1.34,0.83
"Pudding, tapioca, ready-to-eat",8.34,50.0,0.75,1.49
Banana pudding,14.74,84.21,1.35,2.24
Mousse,9.42,124.12,2.58,8.96
Dulce de leche,18.45,105.0,2.28,2.45
"Barfi or Burfi, Indian dessert",89.91,628.89,12.02,25.2
Trifle,16.03,116.55,2.43,4.93
Tiramisu,16.86,202.86,3.42,13.91
White sauce or gravy,3.84,60.0,1.6,4.25
"Cheese, NFS",55.56,4088.89,226.89,329.11
"Cheese, Blue or Roquefort",26.0,3922.22,237.78,319.33
"Cheese, Brick",31.0,4122.22,258.22,329.78
"Cheese, Camembert",1.21,789.47,52.11,63.84
"Cheese, Brie",0.35,260.94,16.21,21.62
"Cheese, Cheddar",27.11,4544.44,258.89,377.78
"Cheese, Cheddar, reduced fat",29.67,3511.11,303.89,226.78
"Cheese, Cheddar, nonfat or fat free",79.33,1744.44,357.11,0.0
"Cheese, Colby",28.56,4377.78,264.0,356.78
"Cheese, Colby Jack",18.0,4266.67,268.0,346.67
"Cheese, Feta",10.21,697.37,37.39,56.55
"Cheese, Fontina",17.22,4322.22,284.44,346.0
"Cheese, goat",0.09,260.0,15.41,21.31
"Cheese, Gouda or Edam",24.67,3955.56,277.11,304.89
"Cheese, Gruyere",4.0,4588.89,331.22,359.33
"Cheese, Limburger",0.22,144.05,8.83,12.0
"Cheese, Monterey",7.56,4144.44,272.0,336.44
"Cheese, Monterey, reduced fat",7.78,3477.78,313.33,240.0
"Cheese, Mozzarella, NFS",49.33,3288.89,263.33,226.67
"Cheese, Mozzarella, part skim",49.33,3288.89,263.33,226.67
"Cheese, Mozzarella, reduced sodium",34.44,3111.11,305.56,190.0
"Cheese, Mozzarella, nonfat or fat free",38.89,1566.67,352.22,0.0
"Cheese, Muenster",12.44,4088.89,260.11,333.78
"Cheese, Muenster, reduced fat",38.89,3011.11,274.44,195.56
"Cheese, Parmesan, dry grated",12.4,420.0,29.6,28.0
"Cheese, Parmesan, dry grated, reduced fat",24.72,372.64,32.83,15.57
"Cheese, Parmesan, hard",120.39,4077.67,287.38,271.84
"Cheese, Parmesan, dry grated, fat free",533.33,4933.33,533.33,66.67
"Cheese, Port du Salut",24.67,3955.56,277.11,304.89
"Cheese, Provolone",23.78,3900.0,284.22,295.78
"Cheese, provolone, reduced fat",38.89,3044.44,274.44,195.56
"Cheese, Swiss",16.0,4366.67,300.0,344.44
"Cheese, Swiss, reduced sodium",37.78,4155.56,315.56,304.44
"Cheese, Swiss, reduced fat",37.78,1988.89,315.56,56.67
"Cheese, Swiss, nonfat or fat free",37.78,1411.11,315.56,0.0
"Cheese, Cheddar, reduced sodium",21.22,4422.22,270.56,362.44
"Cheese, paneer",9.13,121.54,6.45,6.31
"Cheese, Mexican blend",1.55,316.81,20.83,25.23
"Cheese, Mexican blend, reduced fat",3.02,249.56,21.85,17.17
"Queso Anejo, aged Mexican cheese",3.51,282.58,16.24,22.71
Queso Asadero,31.89,3955.56,251.11,314.0
Queso Fresco,33.11,3322.22,201.0,264.67
Queso cotija,3.97,366.0,20.0,30.0
"Cheese, cottage, NFS",2.05,39.05,5.24,1.1
"Cheese, cottage, creamed, large or small curd",1.61,46.67,5.3,2.05
"Cottage cheese, farmer's",1.51,68.1,5.0,4.67
"Cheese, Ricotta",2.44,60.16,3.9,3.85
"Cheese, cottage, with fruit",2.19,32.74,4.16,0.87
"Cheese, cottage, with vegetables",2.49,34.96,4.33,0.88
"Cheese, cottage, dry curd",6.34,68.57,9.85,0.28
"Cheese, cottage, salted, dry curd",6.28,67.62,9.75,0.28
Puerto Rican white cheese,2.33,233.59,14.13,18.61
"Cheese, cottage, low fat",1.91,36.28,4.87,1.02
"Cheese, cottage, lowfat, with fruit",4.42,35.84,3.24,0.68
"Cheese, cottage, lowfat, low sodium",1.19,31.86,5.49,0.44
"Cheese, cottage, lowfat, lactose reduced",1.9,36.12,4.85,1.01
"Cream cheese, regular, plain",2.3,145.83,2.56,14.35
"Cream cheese, regular, flavored",6.83,90.83,2.96,5.78
"Cream cheese, light",3.39,83.75,3.27,6.37
"Cheese, American and Swiss blends",58.56,4088.89,200.0,340.0
"Cheese, American",75.78,3888.89,191.11,313.89
"Cheese, American, reduced fat",117.78,2666.67,195.56,156.67
"Cheese, American, nonfat or fat free",117.0,1400.0,233.89,0.0
"Cheese, American, reduced sodium",17.78,4177.78,246.67,346.56
"Cheese spread, American or Cheddar cheese base, reduced fat",119.0,1955.56,149.0,98.67
"Cream cheese spread, fat free",3.19,43.75,6.54,0.42
"Cheese, processed cheese food",42.14,1461.9,76.62,109.81
"Cheese, processed, with vegetables",43.44,3988.89,158.89,357.0
"Cheese,  with wine",31.22,1082.89,56.75,81.34
"Cheese spread, American or Cheddar cheese base",97.0,3222.22,182.33,235.89
"Cheese spread, Swiss cheese base",30.79,1022.93,57.88,74.89
"Cheese spread, cream cheese, regular",1.46,122.92,2.96,11.92
"Cheese spread, cream cheese, light",3.39,83.75,3.27,6.37
"Cheese spread, pressurized can",3.88,128.89,7.29,9.44
Imitation cheese,4.76,1857.14,119.05,152.38
